{
  "$schema": "https://json-schema.org/draft/2020-12/schema",
  "$id": "https://scrollcase.dev/schema/box-manifest.schema.json",
  "title": "Box manifest (box.json)",
  "description": "The manifest packed inside the archive at box.json. It restates the box's identity, layout and provenance so an extracted box is self-describing: a consumer that has the directory but not the release document can still tell what it is holding and how it was built.",
  "type": "object",
  "additionalProperties": false,
  "required": [
    "schemaVersion",
    "boxId",
    "modelId",
    "runtimeId",
    "version",
    "target",
    "pythonEntryPoint",
    "modelCacheSubdir",
    "selfTest",
    "provenance"
  ],
  "properties": {
    "schemaVersion": { "const": 1 },
    "boxId": { "type": "string", "minLength": 1 },
    "modelId": { "type": "string", "minLength": 1 },
    "runtimeId": { "type": "string", "minLength": 1 },
    "version": { "type": "string", "minLength": 1 },
    "target": { "$ref": "https://scrollcase.dev/schema/target.schema.json" },
    "pythonEntryPoint": { "type": "string", "minLength": 1 },
    "modelCacheSubdir": { "type": "string", "minLength": 1 },
    "selfTest": {
      "type": "object",
      "additionalProperties": false,
      "required": ["pythonImports", "timeoutSeconds"],
      "properties": {
        "pythonImports": {
          "type": "array",
          "minItems": 1,
          "items": { "type": "string", "minLength": 1 }
        },
        "timeoutSeconds": { "type": "integer", "exclusiveMinimum": 0 }
      }
    },
    "provenance": {
      "$ref": "https://scrollcase.dev/schema/release-manifest.schema.json#/$defs/provenance"
    }
  }
}
